<?xml version="1.0" encoding="UTF-8" ?>
<!DOCTYPE freebandPrefs SYSTEM "/home/tatsh/dev/freeband/src/io/fbprefs.dtd">

<freebandPrefs>
  
  <appearance>
    <audience enabled="true" />
    <band enabled="true" />
    <theme>default</theme>
  </appearance>

  <game>
    <difficulty judge="5" />
  </game>
  
  <input>
    <controller type="keyboard" hwid="0x0000" player="1" enabled="true">
      <button type="green">F1</button>
      <button type="red">F2</button>
      <button type="yellow">F3</button>
      <button type="blue">F4</button>
      <button type="orange">F5</button>
      <button type="start">RETURN</button>
      <button type="select">RSHIFT</button>
      <button type="energy">I</button>
      <button type="whammy_down">O</button>
      <button type="whammy_up">P</button>
      <button type="pick_up">ALWAYS</button>
      <button type="pick_down">ALWAYS</button>
      <button type="direction_down">DOWN</button>
      <button type="direction_up">UP</button>
      <button type="direction_left">LEFT</button>
      <button type="direction_right">RIGHT</button>
    </controller>
    
    <controller type="keyboard" hwid="0x0000" player="2" enabled="false">
    </controller>
    
    <controller type="keyboard" hwid="0x0000" player="3" enabled="false">
    </controller>
    
    <controller type="microphone" hwid="0x0000" player="4" enabled="true"/>
    
    <!-- Xbox 360 controller with Linux driver -->
    <controller type="joystick" hwid="0x0000" player="1" enabled="true">
      <button type="green">7</button>
      <button type="red">8</button>
      <button type="yellow">9</button>
      <button type="blue">10</button>
      <button type="orange">11</button>
      <button type="start">0</button>
      <button type="select">1</button>
      <button type="pick_up">2</button>
      <button type="pick_down">3</button>
      <button type="direction_down">12</button>
      <button type="direction_up">13</button>
      <button type="direction_left">14</button>
      <button type="direction_right">15</button>
      <axis type="energy" enabled="true">1</axis>
      <axis type="whammy" enabled="true">2</axis>
    </controller>
    
    <controller type="joystick" hwid="0x0000" player="2" enabled="false">
    </controller>
    
    <controller type="joystick" hwid="0x0000" player="3" enabled="false">
    </controller>
    
  </input>

  <graphics>
    <resolution width="800" height="600" />
    <colour bitdepth="32" />
    <texture size="2048" />
  </graphics>
  
  <online>
    <time_limit enabled="false" time="90" /> <!-- Amount of time users have to pick their set list -->
  </online>
  
  <songs>
    <options menu="true" button="start" />
    <speed_per_title enabled="false" />
    <default_speed_mod speed="0" />
  </songs>

</freebandPrefs>
